{
  "@context": "https://csabaranks.github.io/agentic-job-matching-standard/context/v0.1/ajms.context.jsonld",
  "@type": "ProfileReference",
  "profileId": "urn:uuid:b5fd5d50-a858-5411-ba0e-c7dc0e39ef41",
  "profileType": "CandidateProfile",
  "schemaVersion": "0.1.0",
  "updatedAt": "2026-10-20T09:00:00+02:00",
  "profileView": "PUBLIC_MINIMAL",
  "profileUrl": "https://profiles.example.org/public/9d4a.json",
  "accessMethod": "PUBLIC",
  "mediaType": "application/ld+json",
  "contentDigest": {
    "algorithm": "SHA-256",
    "canonicalization": "AJMS-JSON-SORTED-KEYS-V1",
    "value": "29d3ea280dcc52cdfa4838c85fc91fc44f9cff41ec2fe3ff6c53a68092662102"
  }
}
